{
  "$schema": "urn:agent-team:schema:run:1.0.0",
  "schema_version": "1.0.0",
  "run_id": "run-example-1",
  "work_item_id": "work-example-1",
  "plan_id": "plan-example-1",
  "plan_revision": 1,
  "plan_digest": "sha256:ec8c649fb1f7496a293d92179b801f6de53fb50ca8ed6cdd04bed9f63532aa37",
  "approval_id": "approval-example-1",
  "state": "APPROVED",
  "revision": 0,
  "attempt": 1,
  "lease": null,
  "worker_sessions": [],
  "cost_units_used": 0,
  "started_at": "2026-08-11T05:33:00Z",
  "updated_at": "2026-08-11T05:33:00Z",
  "artifact_refs": [],
  "evidence_bundle_refs": [],
  "idempotency_keys": ["create-run-example-1"]
}
